{
  "version": 1,
  "palettes": {
    "eden_dream": {
      "bg": "#0b1020",
      "fg": "#e6f0ff",
      "accent": "#7aa2f7",
      "muted": "#94a3b8"
    },
    "velvet_division": {
      "bg": "#1a1417",
      "fg": "#F7E7F3",
      "accent": "#E84C7F",
      "muted": "#A08A98"
    },
    "rootfire": {
      "bg": "#0e0f0a",
      "fg": "#f0f5e1",
      "accent": "#b0f566",
      "muted": "#93a48a"
    }
  },
  "daemons": {
    "Saphira": {
      "name": "Saphira",
      "path": "_template\\scripts\\template_daemon.py",
      "enabled": true,
      "tags": [
        "daemon",
        "catalog",
        "index"
      ],
      "team": "Catalog",
      "group": "Archive",
      "env": {
        "EDEN_ENV": "dev"
      },
      "start": {
        "type": "python",
        "args": [
          "saphira.py"
        ]
      }
    },
    "Ranger": {
      "name": "Ranger",
      "path": "all_daemons/Ranger/ranger.py",
      "enabled": true,
      "tags": [],
      "team": "Unassigned",
      "group": "Default",
      "env": {},
      "start": {
        "type": "python",
        "args": [
          "ranger.py"
        ]
      }
    },
    "daemons.yaml": {
      "name": "daemons.yaml",
      "path": "all_daemons/daemons.yaml/daemons.yaml.py",
      "enabled": true,
      "tags": [],
      "team": "Unassigned",
      "group": "Default",
      "env": {},
      "start": {
        "type": "python",
        "args": [
          "daemons.yaml.py"
        ]
      }
    }
  },
  "teams": {
    "Catalog": {
      "members": [
        "Saphira"
      ]
    },
    "Unassigned": {
      "members": [
        "Ranger",
        "daemons.yaml"
      ]
    }
  },
  "groups": {},
  "pairs": [],
  "tasks": []
}